POS.,#,RIDER,HOMETOWN,BIKE,M1,M2,M3,POINTS,TEAM/SPONSORS
1,12,Shane Mcelrath,"Canton, NC",KTM 250 SX-F,3,2,1,26,Troy Lee Designs/ Red Bull/ KTM
2,34,Dylan Ferrandis,"Murrieta, CA",Yamaha YZ250F,2,1,3,23,Monster Energy/Yamalube/Thor/Parts Unlimited/Yamaha
3,39,Colt Nichols,"Muskogee, OK",Yamaha YZ250F,1,3,4,21,Monster Energy/Yamalube/Thor/Parts Unlimited/Yamaha
4,31,Rj Hampshire,"Wesley Chapel, FL",Honda CRF 250,5,4,5,19,GEICO Honda/AMSOIL/Factory Connection
5,92,Adam Cianciarulo,"New Smyrna Beach, FL",Kawasaki KX 250,4,14,2,18,MONSTER ENERGY PRO CIRCUIT KAWASAKI
6,44,Cameron Mcadoo,"Chesterfield, SC",Honda CRF 250,9,5,6,17,GEICO Honda/AMSOIL/Factory Connection
7,156,Jacob Hayes,"Greensboro, NC",Yamaha YZ250F,6,7,9,16,CycleTrader Rock River Yamaha
8,36,Michael Mosiman,"Menifee, CA",Husqvarna FC250,10,6,7,15,Rockstar Energy Husqvarna Factory Racing
9,111,Chris Blose,"Phoenix, AZ",Husqvarna FC250,8,8,8,14,Gas Monkey Energy /AJE Motorsports
10,35,Mitchell Harrison,"Murrieta, CA",Yamaha YZ250F,12,9,11,13,Rockwell Watches | Yamaha | Nuclear Blast Records | Rhino Rush Energy Drink | Ship-EX | Leatt | Gaerne | MX Culture | Skase Motors | Maxima | TechOne | Acerbis | Guts Racing | Dunlop | Dubya | ODI | Renegade Fuels | Pro Circuit | Flo Motorsports | Twin Ai
11,160,Jess Pettis,"Prince George, Canada",KTM 250 SX-F,11,13,10,12,"Redbull, Thor, ktm, WP, 100%, alpinestar"
12,40,Sean Cantrell,"Murrieta, CA",KTM 250 SX-F,13,10,13,11,Troy Lee Designs/ Red Bull/ KTM
13,64,James Decotis,"Peabody, MA",Suzuki RM-Z250,7,20,12,10,Jgrmx/Yoshimura/Suzuki Factory Racing
14,67,Enzo Lopes,"Wildomar, CA",Suzuki RM-Z250,15,11,14,9,Jgrmx Yoshimura Factory Suzuki Racing
15,72,Martin Castelo,"Murrieta, CA",Suzuki RM-Z250,14,12,16,8,Bar X Twisted Development Factory Suzuki
16,60,Justin Starling,"Deland, FL",Husqvarna FC250,16,16,15,7,Gas Monkey Energy /AJE Motorsports
17,141,Robbie Wageman,"Newhall, CA",Honda CRF 250,20,15,18,6,"Fasthouse, BWR Engines, Gaerne, R-Jerky"
18,910,Carson Brown,"Ravensdale, WA",Husqvarna FC250,21,18,17,5,JMC Motorsports Racing/FLY Racing/Husqvarna Motorcycles/Integrity Electric/Axiom Construction/SteelKorr/Custom Floor & Heating/BBR
19,194,Jerry Robin,"Corcoran, MN",KTM 250 SX-F,18,17,21,4, 
20,773,Thomas Do,"SAINT ROMAIN EN VIENNOIS, France",Suzuki RM-Z250,19,22,19,3,JPM
21,61,Garrett Marchbanks,"Coalville, UT",Kawasaki KX 250,17,21,22,2,MONSTER ENERGY PRO CIRCUIT KAWASAKI
22,122,Chris Howell,"Spokane Valley, WA",Husqvarna FC250,22,19,20,1,JMC MOTORSPORTS/ALLIANCE STEEL RACING
